{
  "schemaVersion": "0.1.0",
  "background": {
    "knownStrengths": [],
    "knownWeaknesses": [],
    "priorExperience": []
  },
  "preferences": {
    "pace": "",
    "sessionLengthMinutes": null,
    "teachingStyle": [],
    "codexHelpLevel": "adaptive"
  },
  "constraints": [],
  "goals": [],
  "updatedAt": ""
}

